{
  "id": "cul_fon",
  "name": "Fon",
  "region": [
    "West Africa"
  ],
  "date_range": null,
  "notes": "Fon-speaking (Gbe-language-family) peoples of the Kingdom of Dahomey, modern Benin; oral tradition traces migration from Tado (Mono River) via Allada to Abomey, linguistically dated by comparative Gbe scholarship to roughly the 12th-13th century CE."
}
