{
  "id": "cul_tiwi",
  "name": "Tiwi",
  "region": [
    "Australia"
  ],
  "date_range": null,
  "notes": "Bathurst and Melville Islands (the Tiwi Islands), north of Darwin — culturally and linguistically distinct from mainland Aboriginal Australian groups, historically noted by ethnographers for relative geographic isolation. Non-state, clan/kinship-based sociopolitical organization; no Polity entity modeled."
}
