{
  "id": "cul_warlpiri",
  "name": "Warlpiri",
  "region": [
    "Australia"
  ],
  "date_range": null,
  "notes": "Central Australia (Tanami Desert / Yuendumu region, Northern Territory). \"Walbiri\" is the older anglicized spelling used in earlier ethnography (Munn 1973, Meggitt 1962). Non-state, clan/kinship-based sociopolitical organization; no Polity entity modeled."
}
